[
 {
  "id": "wasserman-music-now-operating-as-the-team",
  "category": "agents",
  "facts": {
   "name": "Wasserman Music (now operating as THE·TEAM)",
   "city": "Los Angeles / New York",
   "country": "US",
   "lane_tags": [
    "indie-electronic",
    "melodic-house-techno",
    "organic-house"
   ],
   "roster_trace": [
    "RÜFÜS DU SOL (signing reported by Rostr)",
    "Ben Böhmer (agency page existed but now redirects",
    "his own site currently lists CAA-affiliated agents)",
    "historically ODESZA and the ex-Paradigm/AM Only electronic roster"
   ],
   "status": "active",
   "act_level": 2,
   "contact": "Contact form at the.team/music-talent/contact-us/",
   "url": "https://the.team",
   "min_draw_band": 4,
   "summary": "RÜFÜS DU SOL (signing reported by Rostr), Ben Böhmer (agency page existed but now redirects; his own site currently lists CAA-affiliated agents), historically ODESZA and the ex-Paradigm/AM Only electronic roster",
   "verify": "Verified Aug 2026: artists.teamwass.com now redirects to the.team ('THE·TEAM') — Wasserman's music arm appears to have rebranded/restructured in 2026; confirm current name and agent moves before citing it. RÜFÜS signing verified via Rostr news; Ben Böhmer listing looks stale (his site names CAA-lane agents). — Contact source: the.team music-talent contact page fetched Aug 2026; IG and LinkedIn linked from the.team itself. Rebrand still fresh — re-check name/agents before citing.",
   "sources": [
    "https://the.team"
   ],
   "seen_date": "2026-08-12"
  },
  "judgment": {
   "profile_id": "demo-hollow-tide",
   "impact": 10,
   "fit": 5,
   "likelihood": 0,
   "group": "above",
   "why": "Agents want a release, a live video and a draw band ≥ 2.",
   "route": "No open door — build receipts first.",
   "flags": [],
   "scored_at": "2026-10-14T22:33:09+00:00",
   "scorer": "mock"
  }
 },
 {
  "id": "tba-agency",
  "category": "agents",
  "facts": {
   "name": "TBA Agency",
   "city": "New York",
   "country": "US",
   "lane_tags": [
    "indie-electronic",
    "melodic-house-techno",
    "organic-house"
   ],
   "roster_trace": [
    "Bob Moses",
    "Tycho",
    "Caribou",
    "Daphni",
    "Yaeji"
   ],
   "status": "active",
   "act_level": 3,
   "contact": "hello@tbaagency.com",
   "url": "https://tbaagency.com",
   "min_draw_band": 3,
   "summary": "Bob Moses, Tycho, Caribou, Daphni, Yaeji, Poolside, The Presets, Todd Terje, Cut Copy, Hot Chip, Mura Masa (roster page verified Aug 2026)",
   "verify": "Roster and contact verified from tbaagency.com Aug 2026. Kerala Dust's TBA artist URL now 404s — they may have left; verify before name-dropping. — Contact source: IG confirmed from tbaagency.com contact page (non-IG source), Aug 2026. Agent list is from a third-party directory (artistandfan) of unknown vintage — verify names before addressing anyone directly.",
   "sources": [
    "https://tbaagency.com"
   ],
   "seen_date": "2026-08-12"
  },
  "judgment": {
   "profile_id": "demo-hollow-tide",
   "impact": 9,
   "fit": 5,
   "likelihood": 1,
   "group": "above",
   "why": "Agents want a release, a live video and a draw band ≥ 2.",
   "route": "No open door — build receipts first.",
   "flags": [],
   "scored_at": "2026-10-14T22:33:09+00:00",
   "scorer": "mock"
  }
 },
 {
  "id": "ground-control-touring",
  "category": "agents",
  "facts": {
   "name": "Ground Control Touring",
   "city": "New York / Los Angeles",
   "country": "US",
   "lane_tags": [
    "indie-electronic",
    "melodic-house-techno",
    "organic-house"
   ],
   "roster_trace": [
    "126+ acts",
    "electronic-adjacent wing incl. Boy Harsher",
    "Black Marble",
    "Drab Majesty (verified)",
    "core is indie/alternative"
   ],
   "status": "active",
   "act_level": 1,
   "contact": "Full agent directory with emails published at groundcontroltouring.com/agents: Eric Dimenstein (President/Co-Founder, Brooklyn) eric@groundcontroltouring.com · Andrew Ellis (Brooklyn) ellis@groundcontroltouring.com · John Chavez (SVP, LA) john@ · Jim Romeo (Co-Founder) jim@",
   "url": "https://www.groundcontroltouring.com",
   "min_draw_band": 2,
   "summary": "126+ acts; electronic-adjacent wing incl. Boy Harsher, Black Marble, Drab Majesty (verified); core is indie/alternative",
   "verify": "Agency, offices and roster names verified from site Aug 2026. Agents page exists but individual emails not captured; no submission policy published. — Contact source: Agents page quoted directly, Aug 2026. Published business addresses, not a demo inbox — they sign from shows, not submissions.",
   "sources": [
    "https://www.groundcontroltouring.com"
   ],
   "seen_date": "2026-08-12"
  },
  "judgment": {
   "profile_id": "demo-hollow-tide",
   "impact": 8,
   "fit": 5,
   "likelihood": 1,
   "group": "above",
   "why": "Agents want a release, a live video and a draw band ≥ 2.",
   "route": "No open door — build receipts first.",
   "flags": [],
   "scored_at": "2026-10-14T22:33:09+00:00",
   "scorer": "mock"
  }
 },
 {
  "id": "paladin-artists",
  "category": "agents",
  "facts": {
   "name": "Paladin Artists",
   "city": "New York / Los Angeles / London",
   "country": "US",
   "lane_tags": [
    "indie-electronic",
    "melodic-house-techno",
    "organic-house"
   ],
   "roster_trace": [
    "Music",
    "DJs",
    "comedy and speakers divisions",
    "music roster incl. A Place To Bury Strangers",
    "10"
   ],
   "status": "active",
   "act_level": 2,
   "contact": "Booking form on site · +1 917-277-3384 · Booking form and phone 917-277-3384 re-confirmed",
   "url": "https://www.paladinartists.com",
   "min_draw_band": 2,
   "summary": "Music, DJs, comedy and speakers divisions; music roster incl. A Place To Bury Strangers, 10,000 Maniacs (verified); dedicated DJ category",
   "verify": "Offices, divisions, form and phone verified from site Aug 2026. No melodic-house names visible on roster — fit is structural (accessible NY/London indie with DJ division), not scene-based. — Contact source: Form, phone and IG from paladinartists.com, Aug 2026. No individual agent emails published.",
   "sources": [
    "https://www.paladinartists.com"
   ],
   "seen_date": "2026-08-12"
  },
  "judgment": {
   "profile_id": "demo-hollow-tide",
   "impact": 8,
   "fit": 5,
   "likelihood": 1,
   "group": "above",
   "why": "Agents want a release, a live video and a draw band ≥ 2.",
   "route": "No open door — build receipts first.",
   "flags": [],
   "scored_at": "2026-10-14T22:33:09+00:00",
   "scorer": "mock"
  }
 },
 {
  "id": "rob-toma",
  "category": "bookers",
  "facts": {
   "name": "Rob Toma",
   "org": "Teksupport",
   "city": "New York",
   "country": "US",
   "lane_tags": [
    "indie-electronic"
   ],
   "status": "active",
   "act_level": 1,
   "url": "https://teksupport.nyc",
   "min_draw_band": 4,
   "summary": "Large-scale NYC warehouse shows and club takeovers (Circoloco, Afterlife, Keinemusik brand nights); books touring headline electronic acts, not openers from the local pool",
   "verify": "Rob Toma confirmed founder; no published booking email — Teksupport books via agents/promoter network only — Toma as founder verified via Forbes profile (Jan 2024) and Billboard feature (2024); Mixmag feature on Teksupport's NYC dominance. Role current as of 2024 press — verify still active but company clearly operating. — Contact source: Founder role per Billboard feature (2023) and Forbes (Jan 2024); personal IG @robtnyc surfaced in Aug 2026 search results (org account @teksupport). No 2026 personnel change found — verify at pitch time.",
   "sources": [
    "https://teksupport.nyc"
   ],
   "seen_date": "2026-08-12"
  },
  "judgment": {
   "profile_id": "demo-hollow-tide",
   "impact": 10,
   "fit": 5,
   "likelihood": 1,
   "group": "above",
   "why": "Books acts at draw band 4; you're at 1; no open door; same city.",
   "route": "Be visible on the bills that feed their undercards.",
   "flags": [
    "contact-unpublished"
   ],
   "scored_at": "2026-10-14T22:33:09+00:00",
   "scorer": "mock"
  }
 },
 {
  "id": "todd-patrick-todd-p",
  "category": "bookers",
  "facts": {
   "name": "Todd Patrick (Todd P)",
   "org": "Market Hotel / Trans-Pecos (independent promoter)",
   "city": "New York",
   "country": "US",
   "lane_tags": [
    "indie-electronic",
    "live-electronic-downtempo"
   ],
   "status": "active",
   "act_level": 2,
   "contact": "booking@markethotel.org (concerts, pre-11pm) · nightlife@markethotel.org (late-night) · info@markethotel.org (general)",
   "contact_source": "Published booking address / form on the organisation's site",
   "url": "https://en.wikipedia.org/wiki/Todd_Patrick",
   "min_draw_band": 1,
   "summary": "DIY and independent shows across multiple Brooklyn/Queens rooms (Market Hotel, Trans-Pecos, one-off spaces); emerging live acts of all genres including electronic-leaning bills",
   "verify": "Role as promoter behind Market Hotel/Trans-Pecos verified via Wikipedia and long press history (Fader, Brooklyn Vegan). Long-standing and still operating; specific submission emails not republished here — use venues' published booking channels. — Contact source: Emails and IG fetched directly from markethotel.org/contact, Aug 2026 — current.",
   "sources": [
    "https://en.wikipedia.org/wiki/Todd_Patrick"
   ],
   "seen_date": "2026-08-12"
  },
  "judgment": {
   "profile_id": "demo-hollow-tide",
   "impact": 6,
   "fit": 8,
   "likelihood": 8,
   "group": "now",
   "why": "Same city.",
   "route": "Use the published route.",
   "flags": [],
   "scored_at": "2026-10-14T22:33:09+00:00",
   "scorer": "mock"
  }
 },
 {
  "id": "adhoc-presents-booking-desk",
  "category": "bookers",
  "facts": {
   "name": "AdHoc Presents booking desk",
   "org": "AdHoc",
   "city": "New York",
   "country": "US",
   "lane_tags": [
    "indie-electronic",
    "live-electronic-downtempo"
   ],
   "status": "active",
   "act_level": 2,
   "contact": "Contact form at adhoc.fm/about",